<?xml version="1.0" encoding="UTF-8"?>
<i:DesignSpace id="realPSO"
	xmlns:i="http://TheInPUT.org/DesignSpace" xmlns:xsi="http://www.w3.org/2001/XMLSchema-instance"
	xsi:schemaLocation="http://TheInPUT.org/DesignSpace http://TheInPUT.org/DesignSpace.xsd ">
	<i:NParam id="Seed" type="decimal" />
	<i:NParam id="PopSize" type="integer" inclMin="2" inclMax="50"/>
	<i:NParam id="InitPosMin" type="decimal" inclMin="-4" inclMax="-1"/>
	<i:NParam id="InitPosMax" type="decimal" inclMin="1" inclMax="4"/>
	<i:NParam id="InitVelMin" type="decimal" inclMin="-3" inclMax="-0.5"/>
	<i:NParam id="InitVelMax" type="decimal" inclMin="0.5" inclMax="3"/>
	<i:NParam id="VelMin" type="decimal" inclMin="-4" inclMax="-0.5"/>
	<i:NParam id="VelMax" type="decimal" inclMin="0.5" inclMax="4"/>
	<i:SParam id="VelocityType">
		<i:SParam id="Topology">
			<i:NParam id="Neighborhood" type="integer" inclMin="2" inclMax="10"/>
			<i:SChoice id="Ring" />
			<i:SChoice id="Linear" />
		</i:SParam>
		<i:NParam id="Inertia" type="decimal" inclMin="0" inclMax="5" />
		<i:NParam id="LFactor1" type="decimal" inclMin="0.1" inclMax="3" />
		<i:NParam id="LFactor2" type="decimal" inclMin="0.1" inclMax="5" />
		<i:SChoice id="Standard" />
		<i:SChoice id="Constricted" />
		<i:SChoice id="FixedInertiaWeight" />
		<i:SChoice id="VariableInertiaWeight" />
		<i:SChoice id="Extended">
			<i:NParam id="LFactor3" type="decimal" inclMin="0" inclMax="5" />
		</i:SChoice>
	</i:SParam>
	<i:SParam id="StopCriterion">
		<i:SChoice id="Time">
			<i:NParam id="Ms" type="integer" inclMin="1" />
		</i:SChoice>
		<i:SChoice id="Generations">
			<i:NParam id="Amount" type="integer" inclMin="2" inclMax="100" />
		</i:SChoice>
		<i:SChoice id="SteadyFit">
			<i:NParam id="MinGen" type="integer" inclMin="10" inclMax="50" />
			<i:NParam id="Interval" type="integer" inclMin="1" inclMax="20" />
		</i:SChoice>
	</i:SParam>
</i:DesignSpace>
